doi,title,abstract,label_included
,,"identify explicitly as a “systematic review” in their title
assess the effect of a non-acute, non-communicable, environmental exposure on a health outcome
include studies in people or mammalian models
be available in HTML format
be published between 1 January 2019 and 30 June 2020
exposure to second-hand smoke
diet and addiction as exposures
SRs had to be available in HTML format",0
,,"umbrella reviews
review protocols
SRs [systematic reviews] of the wrong population (e.g. plants)
SRs of the following exposures: pathogens; poisons; smoking and tobaccorelated products
social, psychological, or behavioural risk factors
housing conditions
SRs of exposure only (e.g. biomonitoring)
protocols for SRs",1
