doi,title,abstract,label_included
,,"Presence of a diagnostic status of MDD [major depressive disorder] (MDD absence and/or presence) for all participants, as determined through a clinical interview (e.g., SCID [Structured Clinical Interview for DSM axis-I diagnoses], K-SADS [Schedule for Affective Disorders and Schizophrenia-Lifetime] from DSM [ Diagnostic and Statistical Manual of Mental Disorders], CIDI [Composite International Diagnostic Interview] from ICD [ International Statistical Classification of Diseases and Related Health Problems]) or by a clinician at the start of the study;
At some point during the study, participants needed to be in (partial) remission or recovery as determined by a clinical interview or clinician assessment;
relapse or recurrence was diagnosed through a clinical interview or by a clinician.
The study design was longitudinal and prospective;
The theory-derived predictor (i.e., the proposed factors) was assessed before the relapse or recurrence of MDD; 
The predictor was derived from one of the leading psychological theories;
Sufficient information was reported to calculate effect sizes (or was made available upon request).
Language was restricted to English.
the publication with the longest follow-up time, or the largest number of participants in case of equal follow-up time.",0
,,"the presence of bipolar disorder, dysthymia, seasonal affective disorder, postpartum depression, late-life MDD, or MDD due to medical disorders.
solely included people with a first onset MDD  [major depressive disorder] when they were older than 65 years",1
